{"$schema":"../skill-capsule-index.schema.json","capsule_count":120,"capsule_schema":{"path":"references/skill-capsule.schema.json","sha256":"a3f9a9215061d93a42b81c7e471a6b6dc9e798d2939b646b5d449b1755054a31"},"capsules":[{"capsule_ref":"references/skill-capsules/ad-account-auditor.json","capsule_sha256":"42f85b213b4c9ce80ea87dbd9082476fc0dc7033273d7ec781041fe669fb3b34","model_bytes":12630,"skill":"ad-account-auditor"},{"capsule_ref":"references/skill-capsules/ad-creative-builder.json","capsule_sha256":"fe78ad09db063b9eb8b6a1973c7b7f835f445598ce5fe5ca8c537ae80613eed9","model_bytes":11156,"skill":"ad-creative-builder"},{"capsule_ref":"references/skill-capsules/ad-test-designer.json","capsule_sha256":"24da5d19c1befd5a60d6b88da51a4cec5eb964de273e11ad22714b71c61528ec","model_bytes":10430,"skill":"ad-test-designer"},{"capsule_ref":"references/skill-capsules/advocacy-program-designer.json","capsule_sha256":"cecb60ff621ae379c5872640de24c5bdc215cd63116ffc923efc305f4929c57e","model_bytes":12608,"skill":"advocacy-program-designer"},{"capsule_ref":"references/skill-capsules/attribution-reconciler.json","capsule_sha256":"6d115f6e525bc879bcc63b377461c67f1a5de8a5afe2cda4181849a83e2d257f","model_bytes":10049,"skill":"attribution-reconciler"},{"capsule_ref":"references/skill-capsules/audience-belief-mapper.json","capsule_sha256":"34b926fcfd33980e1c20ca7362d63113c544b484c2b15aa0ace235972a53d850","model_bytes":11591,"skill":"audience-belief-mapper"},{"capsule_ref":"references/skill-capsules/audience-mapper.json","capsule_sha256":"59441a3cb8c80c1580d0284b7e7c53f3ffa5744ddcbb1dbbfca0b14565abb09f","model_bytes":12765,"skill":"audience-mapper"},{"capsule_ref":"references/skill-capsules/audience-segment-builder.json","capsule_sha256":"92de08017d2ad51a9ac4d0529f95fa81223e8b70a23b6f96a248e763cf26dc5a","model_bytes":9978,"skill":"audience-segment-builder"},{"capsule_ref":"references/skill-capsules/bid-strategy-planner.json","capsule_sha256":"271f599efc32e51b2be60728703f21c8a38a8f4a46e92a1532b3c5c5ceb24ed2","model_bytes":12205,"skill":"bid-strategy-planner"},{"capsule_ref":"references/skill-capsules/brand-language-codifier.json","capsule_sha256":"7c66a68ff161321ede619b1507038c1d70ec2721dcf58c0c5972028e03ce0028","model_bytes":12423,"skill":"brand-language-codifier"},{"capsule_ref":"references/skill-capsules/brief-generator.json","capsule_sha256":"1af63156d0d1c463d8177474c619e9e50905dfa592e8f76782862f7e5d3cc52d","model_bytes":10243,"skill":"brief-generator"},{"capsule_ref":"references/skill-capsules/budget-optimizer.json","capsule_sha256":"b201ce1e90ac10b22dc232e629ac12c3de89ecd1e5c5dba99bef2217c115fb35","model_bytes":13114,"skill":"budget-optimizer"},{"capsule_ref":"references/skill-capsules/budget-pacing-monitor.json","capsule_sha256":"246320290ad8444f1038583c6d256fede5291df64e21b301d6ee44486a5c8117","model_bytes":11439,"skill":"budget-pacing-monitor"},{"capsule_ref":"references/skill-capsules/campaign-architect.json","capsule_sha256":"734eda1286c88ebdd35dee712bce296e2eb39a44e3d35086c6fb3caffaa68182","model_bytes":10159,"skill":"campaign-architect"},{"capsule_ref":"references/skill-capsules/campaign-planner.json","capsule_sha256":"0cf611ac496e32c98daf3cf4f6e9b564cf7bf7ee320612e4dcc45178933e4258","model_bytes":10199,"skill":"campaign-planner"},{"capsule_ref":"references/skill-capsules/category-narrative-mapper.json","capsule_sha256":"809b820e31f0fcfa2c8d37fca988893f840bd39c65ccb0d6876baed1be184761","model_bytes":12262,"skill":"category-narrative-mapper"},{"capsule_ref":"references/skill-capsules/channel-portfolio-planner.json","capsule_sha256":"f0f25e820451e3018e478e085868b3a017a5b8e255c401efff68be6020c95d31","model_bytes":12351,"skill":"channel-portfolio-planner"},{"capsule_ref":"references/skill-capsules/channel-registry.json","capsule_sha256":"66a9472e7c110d298c666fb7d9725f46f8602cb892d9fb280db6c04f92b883c7","model_bytes":9474,"skill":"channel-registry"},{"capsule_ref":"references/skill-capsules/cold-outbound-sequencer.json","capsule_sha256":"a718c632c8977280dcc0d2ae30485a783708a4d2b7361ee75defff4f094ce70e","model_bytes":14569,"skill":"cold-outbound-sequencer"},{"capsule_ref":"references/skill-capsules/community-launch-runner.json","capsule_sha256":"326d9781975185e62e2775c6f3dff321f3757c47193aa0216fcb270421d71d9d","model_bytes":13658,"skill":"community-launch-runner"},{"capsule_ref":"references/skill-capsules/competitor-analysis.json","capsule_sha256":"c9e181082c2ae8ae8c4a4cf42928f56f9847b9f7cba812e31e3d79965747571c","model_bytes":10584,"skill":"competitor-analysis"},{"capsule_ref":"references/skill-capsules/competitor-tracker.json","capsule_sha256":"78a96e9bb2c91382230c3fc156c8dd3946bf168dc5289be04cbdfdf13fdbc0f8","model_bytes":10683,"skill":"competitor-tracker"},{"capsule_ref":"references/skill-capsules/consent-registry.json","capsule_sha256":"695a371f748feb667711cda978443b5974599f2ce65304fc4a65ce57b928410e","model_bytes":11139,"skill":"consent-registry"},{"capsule_ref":"references/skill-capsules/content-amplifier.json","capsule_sha256":"ab72bbebd113a229cfc9d4ac8f6be40df50cdfb45d3b7be748593f3ffc59229f","model_bytes":18143,"skill":"content-amplifier"},{"capsule_ref":"references/skill-capsules/content-gap-analysis.json","capsule_sha256":"d83faeb1986c2439f8568571c55722c632e4a291752453c7349e7e92f587da4e","model_bytes":9447,"skill":"content-gap-analysis"},{"capsule_ref":"references/skill-capsules/content-quality-auditor.json","capsule_sha256":"2d5e103bff8c901ad2d49f20ad1718a1ffd109f8ec1866fff05099db9d1c961f","model_bytes":14006,"skill":"content-quality-auditor"},{"capsule_ref":"references/skill-capsules/content-writer.json","capsule_sha256":"49af144cde965f46aa97871a8d1941f44026715aab2f150cbf28ae2160ed80c5","model_bytes":14930,"skill":"content-writer"},{"capsule_ref":"references/skill-capsules/contract-helper.json","capsule_sha256":"8a4547afbfddd1dc0321e9fa743ac9dc1c37034eda059d87d014a6718f77f300","model_bytes":11188,"skill":"contract-helper"},{"capsule_ref":"references/skill-capsules/conversion-signal-qa.json","capsule_sha256":"f48612905a54d1e14dff2f5e44b48637e3c16d9bde963794a9289b6257172e89","model_bytes":9330,"skill":"conversion-signal-qa"},{"capsule_ref":"references/skill-capsules/conversion-value-mapper.json","capsule_sha256":"4bd77ad27421dd2d78c87364193139707f7fc0ed790edca28fa0b56b2cb77fee","model_bytes":11595,"skill":"conversion-value-mapper"},{"capsule_ref":"references/skill-capsules/creator-content-auditor.json","capsule_sha256":"53fa5c169ebf656f374d70dbf70f65367889cb260ad01ca5e600b10d63648611","model_bytes":14086,"skill":"creator-content-auditor"},{"capsule_ref":"references/skill-capsules/creator-registry.json","capsule_sha256":"c70fb5988775a11812d249a5d2bd14549bd20e3e615f7a675c44079a34696281","model_bytes":9753,"skill":"creator-registry"},{"capsule_ref":"references/skill-capsules/crisis-response-planner.json","capsule_sha256":"c7e2cd8e7fa3b4700f3ad8615c137b0c02073f9e5f240c20bcf62e68d755669d","model_bytes":13307,"skill":"crisis-response-planner"},{"capsule_ref":"references/skill-capsules/dark-social-attributor.json","capsule_sha256":"ba446344a57b2a06f0ab838ff7ebb3838177998a499049244a5a6babf08fa0af","model_bytes":12981,"skill":"dark-social-attributor"},{"capsule_ref":"references/skill-capsules/deliverability-qa.json","capsule_sha256":"09b94a4ae1ba5d0a7ee4e5fe9a8232434b3391f4b0d078fd1733d88ebc491c62","model_bytes":13558,"skill":"deliverability-qa"},{"capsule_ref":"references/skill-capsules/domain-authority-auditor.json","capsule_sha256":"3ae1333e9bca886160eb2f78abe5dd9fcbba9a7fed7f3d7cafc8beeea363ac3b","model_bytes":12816,"skill":"domain-authority-auditor"},{"capsule_ref":"references/skill-capsules/dynamic-content-personalizer.json","capsule_sha256":"e366e35f88be78d67faeeaccb6e69804d4658a03e7401782ddf15ad75b11d275","model_bytes":14377,"skill":"dynamic-content-personalizer"},{"capsule_ref":"references/skill-capsules/early-access-designer.json","capsule_sha256":"6cba11aee3157142dc9ff65c707a957a10910f3d980667807f758d2daa7177d9","model_bytes":12973,"skill":"early-access-designer"},{"capsule_ref":"references/skill-capsules/email-creative-builder.json","capsule_sha256":"09c2d8e9f1e2cd53cbef4ee28843dcec43928298f80c95e3b220f4b056186088","model_bytes":13537,"skill":"email-creative-builder"},{"capsule_ref":"references/skill-capsules/email-quality-auditor.json","capsule_sha256":"2de5f66b7d04142f8f70514e86a45229031b09110a2b4ee0382824614fd03aeb","model_bytes":12679,"skill":"email-quality-auditor"},{"capsule_ref":"references/skill-capsules/email-render-builder.json","capsule_sha256":"7c0665125c222aae2860933690ec38de34b77acab407aa4b82edbad055851ef6","model_bytes":14331,"skill":"email-render-builder"},{"capsule_ref":"references/skill-capsules/email-sequence-designer.json","capsule_sha256":"6e57130cd5d82c5259925165e66b353506e5cc3b804f2c1eb46bacb34395a202","model_bytes":16353,"skill":"email-sequence-designer"},{"capsule_ref":"references/skill-capsules/engagement-inbox-manager.json","capsule_sha256":"540018a10f6db0b0960d7e732880774234f232f42f961a21470711db531c064b","model_bytes":12387,"skill":"engagement-inbox-manager"},{"capsule_ref":"references/skill-capsules/entity-registry.json","capsule_sha256":"ab37351d7c9fed2e364ddf9e48ac2a3151f7fb6267f5bac91c7ceca7de33d445","model_bytes":11239,"skill":"entity-registry"},{"capsule_ref":"references/skill-capsules/fatigue-frequency-manager.json","capsule_sha256":"f9a349e67a42f02ec4dbb34e46349ca8304da30e783f74c4aa5d5d444c9effa5","model_bytes":11760,"skill":"fatigue-frequency-manager"},{"capsule_ref":"references/skill-capsules/fit-scorer.json","capsule_sha256":"e38688b1bf4a759d7667622e9f14e87af88ec93c681167c82a66fe45743b5b62","model_bytes":13742,"skill":"fit-scorer"},{"capsule_ref":"references/skill-capsules/geo-content-optimizer.json","capsule_sha256":"0e113a229d0f9a1a2df4868c2c4012f933cff383bf6fb52d183d3fdc9e7e04bc","model_bytes":9505,"skill":"geo-content-optimizer"},{"capsule_ref":"references/skill-capsules/inbox-placement-monitor.json","capsule_sha256":"13c074f50766fa7d9f0377795fd469852bf2f4c542677a5e88475b59